{
  "/home/ftran/Temp/serverless-project/serverless.yml": {
    "versionFramework": "4.7.0",
    "servicePath": "/home/ftran/Temp/serverless-project/serverless.yml",
    "serviceConfigFileName": "serverless.yml",
    "service": {
      "service": "serverless-voice-generator",
      "plugins": [
        "serverless-python-requirements",
        "serverless-wsgi",
        "serverless-dynamodb-local",
        "serverless-s3-local"
      ],
      "custom": {
        "wsgi": {
          "app": "app.app",
          "packRequirements": false
        },
        "pythonRequirements": {
          "dockerizePip": true
        },
        "serverless-dynamodb": {
          "stages": [
            "dev"
          ],
          "start": {
            "docker": true,
            "port": 8000,
            "inMemory": true,
            "migrate": true,
            "seed": true,
            "convertEmptyValues": true
          }
        },
        "s3": {
          "bucketName": "voice-generator-bucket",
          "directory": "./.serverless/s3"
        }
      },
      "provider": {
        "name": "aws",
        "runtime": "python3.10",
        "stage": "dev",
        "region": "us-east-1",
        "environment": {
          "DYNAMODB_TABLE": "serverless-voice-generator-dev"
        },
        "iam": {
          "role": {
            "statements": [
              {
                "Effect": "Allow",
                "Action": [
                  "dynamodb:Query",
                  "dynamodb:Scan",
                  "dynamodb:GetItem",
                  "dynamodb:PutItem",
                  "dynamodb:UpdateItem",
                  "dynamodb:DeleteItem",
                  "s3:PutObject",
                  "s3:GetObject"
                ],
                "Resource": "arn:aws:dynamodb:us-east-1:*:table/serverless-voice-generator-dev"
              }
            ]
          }
        },
        "versionFunctions": true
      },
      "functions": {
        "app": {
          "handler": "wsgi.handler",
          "events": [
            {
              "http": "ANY /"
            },
            {
              "http": "ANY {proxy+}"
            }
          ],
          "name": "serverless-voice-generator-dev-app"
        },
        "createVoice": {
          "handler": "wsgi.handler",
          "events": [
            {
              "http": "POST /voice"
            }
          ],
          "name": "serverless-voice-generator-dev-createVoice"
        },
        "getVoice": {
          "handler": "wsgi.handler",
          "events": [
            {
              "http": "GET /voice/{proxy+}"
            }
          ],
          "name": "serverless-voice-generator-dev-getVoice"
        },
        "listVoice": {
          "handler": "wsgi.handler",
          "events": [
            {
              "http": "GET /voices"
            }
          ],
          "name": "serverless-voice-generator-dev-listVoice"
        }
      },
      "resources": {
        "Resources": {
          "MyS3Bucket": {
            "Type": "AWS::S3::Bucket",
            "Properties": {
              "BucketName": "voice-generator-bucket"
            }
          },
          "UrlTable": {
            "Type": "AWS::DynamoDB::Table",
            "Properties": {
              "TableName": "serverless-voice-generator-dev",
              "AttributeDefinitions": [
                {
                  "AttributeName": "key",
                  "AttributeType": "S"
                }
              ],
              "KeySchema": [
                {
                  "AttributeName": "key",
                  "KeyType": "HASH"
                }
              ],
              "BillingMode": "PAY_PER_REQUEST"
            }
          }
        }
      }
    },
    "provider": {
      "name": "aws",
      "runtime": "python3.10",
      "stage": "dev",
      "region": "us-east-1",
      "environment": {
        "DYNAMODB_TABLE": "serverless-voice-generator-dev"
      },
      "iam": {
        "role": {
          "statements": [
            {
              "Effect": "Allow",
              "Action": [
                "dynamodb:Query",
                "dynamodb:Scan",
                "dynamodb:GetItem",
                "dynamodb:PutItem",
                "dynamodb:UpdateItem",
                "dynamodb:DeleteItem",
                "s3:PutObject",
                "s3:GetObject"
              ],
              "Resource": "arn:aws:dynamodb:us-east-1:*:table/serverless-voice-generator-dev"
            }
          ]
        }
      },
      "versionFunctions": true
    },
    "dashboard": {
      "isEnabledForService": false,
      "requiredAuthentication": false,
      "orgFeaturesInUse": null,
      "orgObservabilityIntegrations": null,
      "serviceAppId": null,
      "serviceProvider": null,
      "instanceParameters": null
    },
    "serviceRawFile": "service: serverless-voice-generator\n\nplugins:\n  - serverless-python-requirements\n  - serverless-wsgi\n  - serverless-dynamodb-local\n  - serverless-s3-local\n\ncustom:\n  wsgi:\n    app: app.app\n    packRequirements: false\n  pythonRequirements:\n    dockerizePip: true\n  serverless-dynamodb:\n    # If you only want to use DynamoDB Local in some stages, declare them here\n    stages:\n      - dev\n    start:\n      docker: true\n      port: 8000\n      inMemory: true\n      migrate: true\n      seed: true\n      convertEmptyValues: true\n  s3:\n    bucketName: voice-generator-bucket\n    directory: './.serverless/s3'\n\nprovider:\n  name: aws\n  runtime: python3.10\n  stage: dev\n  region: us-east-1\n  environment:\n    DYNAMODB_TABLE: ${self:service}-${opt:stage, self:provider.stage}\n  iam:\n    role:\n      statements:\n        - Effect: Allow\n          Action:\n            - dynamodb:Query\n            - dynamodb:Scan\n            - dynamodb:GetItem\n            - dynamodb:PutItem\n            - dynamodb:UpdateItem\n            - dynamodb:DeleteItem\n            - s3:PutObject\n            - s3:GetObject\n          Resource: \"arn:aws:dynamodb:${opt:region, self:provider.region}:*:table/${self:provider.environment.DYNAMODB_TABLE}\"\n\nfunctions:\n  app:\n    handler: wsgi.handler\n    events:\n      - http: ANY /\n      - http: 'ANY {proxy+}'\n  createVoice:\n    handler: wsgi.handler\n    events:\n      - http: 'POST /voice'\n  getVoice:\n    handler: wsgi.handler\n    events:\n      - http: 'GET /voice/{proxy+}'\n  listVoice:\n    handler: wsgi.handler\n    events:\n      - http: GET /voices\n\n\nresources:\n  Resources:\n    MyS3Bucket:\n      Type: AWS::S3::Bucket\n      Properties:\n        BucketName: voice-generator-bucket\n    UrlTable:\n      Type: AWS::DynamoDB::Table\n      Properties:\n        TableName: ${self:provider.environment.DYNAMODB_TABLE}\n        AttributeDefinitions:\n          - AttributeName: key\n            AttributeType: S\n        KeySchema:\n          - AttributeName: key\n            KeyType: HASH\n        BillingMode: PAY_PER_REQUEST\n",
    "command": [
      "s3",
      "start"
    ],
    "options": {},
    "orgId": "3eb61bde-08a1-4781-a2c8-d1c4ddcd742b",
    "orgName": "esgicloudcomputing",
    "userId": "1hfJKHx3HqFzqbpFkT",
    "userName": "esgicloudcomputing",
    "serviceProviderAwsAccountId": "873488434914",
    "serviceProviderAwsCfStackId": null,
    "serviceProviderAwsCfStackCreated": null,
    "serviceProviderAwsCfStackUpdated": null,
    "serviceProviderAwsCfStackStatus": null,
    "serviceProviderAwsCfStackOutputs": null
  }
}